{
  "$schema": "https://json-schema.org/draft/2020-12/schema",
  "$id": "urn:myad:research:schema:fact",
  "title": "Fact ledger entry",
  "description": "One checkable fact. research/facts/<topic>.json is a JSON array of these. Only verified facts or labeled demo facts render as figures.",
  "type": "object",
  "required": [
    "id",
    "claim",
    "value",
    "unit",
    "jurisdiction",
    "source_id",
    "url",
    "quote",
    "retrieved_at",
    "check_every",
    "status"
  ],
  "properties": {
    "id": {
      "type": "string",
      "pattern": "^(us|us-fl|us-fl-miamidade|us-fl-miami)(\\.[a-z0-9][a-z0-9_-]*)+$",
      "description": "Dotted, lowercase, region-scoped; first segment is the pack id."
    },
    "claim": {
      "type": "string",
      "minLength": 1,
      "description": "Plain sentence stating the fact (research-facing, not displayed)."
    },
    "value": {
      "type": [
        "string",
        "number",
        "boolean",
        "array",
        "object",
        "null"
      ],
      "description": "The value in the form the server ledger loader types directly (server/src/myad_server/ledger.py coerce_value). null for kind:lookup, for unsourced facts with no value, and never a sentinel for 'none recorded' (that is an outcome; see demo-outcomes.json). By value_type: text = string plus value_language (BCP-47, e.g. 'en'); code = string, never translated; codes = JSON array of strings; phone = digits with optional separators, no extension (put it in `extension`); date = 'YYYY-MM-DD'; money = decimal string or number with unit an ISO 4217 code ('USD'), any period or qualifier in unit_detail; quantity = decimal string or number with unit; weekdays = comma-separated lowercase English weekday names or a JSON array; place = typed object {type:'place', place:{name, coordinate:{latitude, longitude}, address?, language?}}; flag = JSON boolean. A typed FactValue object ({type: ...}) is accepted for any value_type."
    },
    "unit": {
      "type": [
        "string",
        "null"
      ],
      "description": "Unit. For money exactly an ISO 4217 code ('USD'); put the period or qualifier ('per month, gross rent limit') in unit_detail. For quantity a unit string ('days', 'year'). null when not applicable."
    },
    "jurisdiction": {
      "type": "string",
      "enum": [
        "us",
        "us-fl",
        "us-fl-miamidade",
        "us-fl-miami"
      ]
    },
    "source_id": {
      "type": "string",
      "description": "id in research/sources.yaml. Empty string only when status is unsourced or demo with no retrievable source."
    },
    "url": {
      "type": [
        "string",
        "null"
      ],
      "description": "Exact URL the quote was taken from; null only when unsourced or demo without a source."
    },
    "quote": {
      "type": [
        "string",
        "null"
      ],
      "description": "Exact text copied from the source, whitespace-normalized; ' ... ' marks an elision between exact segments. Never paraphrased. For lookup facts: a short snippet of a live sample response."
    },
    "retrieved_at": {
      "type": "string",
      "format": "date-time",
      "description": "ISO 8601 with offset: when the source was read (for unsourced: when the search was done)."
    },
    "check_every": {
      "type": "string",
      "pattern": "^P(?!$)([0-9]+Y)?([0-9]+M)?([0-9]+W)?([0-9]+D)?$",
      "description": "ISO 8601 duration, e.g. P7D, P30D, P90D, P1Y."
    },
    "status": {
      "type": "string",
      "enum": [
        "verified",
        "stale",
        "unsourced",
        "demo"
      ]
    },
    "value_type": {
      "type": "string",
      "enum": [
        "text",
        "code",
        "codes",
        "phone",
        "date",
        "money",
        "quantity",
        "weekdays",
        "place",
        "flag"
      ],
      "description": "One of the ten ADCore FactValue cases (ARCHITECTURE.md 13.z). Required when kind is lookup. quantity requires unit."
    },
    "kind": {
      "type": "string",
      "enum": [
        "static",
        "lookup"
      ],
      "default": "static",
      "description": "static (default) or lookup (address-dependent; value null; resolved at a pin by the lookup block)."
    },
    "lookup": {
      "type": "object",
      "required": [
        "endpoint",
        "layer_id",
        "fields",
        "method",
        "question"
      ],
      "properties": {
        "endpoint": {
          "type": "string",
          "minLength": 1
        },
        "layer_id": {
          "type": [
            "string",
            "integer",
            "null"
          ]
        },
        "fields": {
          "type": "array",
          "items": {
            "type": "string"
          },
          "minItems": 1
        },
        "method": {
          "type": "string",
          "minLength": 1
        },
        "question": {
          "type": "string",
          "minLength": 1
        },
        "params": {
          "type": "object"
        },
        "notes": {
          "type": "string"
        }
      },
      "additionalProperties": false
    },
    "desk": {
      "type": [
        "string",
        "null"
      ],
      "pattern": "^(us|us-fl|us-fl-miamidade|us-fl-miami)\\.[a-z0-9.-]+$",
      "description": "Desk id (pack-scoped, lowercase) the card hands off to. Desk contact facts are <desk-id>.name/.phone/.url/.address/.hours/.languages."
    },
    "plan_value": {
      "type": [
        "string",
        "null"
      ],
      "description": "What the plan files said."
    },
    "plan_ref": {
      "type": "string",
      "description": "Plan file + nearby heading."
    },
    "correction_note": {
      "type": "string",
      "description": "Present when the source disagrees with the plan."
    },
    "notes": {
      "type": "string",
      "description": "Research notes: what was searched, caveats."
    },
    "secondary": {
      "type": "boolean",
      "description": "true when the source is not official (source official:false)."
    },
    "topics": {
      "type": "array",
      "items": {
        "type": "string",
        "pattern": "^[a-z0-9]+(-[a-z0-9]+)*$"
      },
      "uniqueItems": true,
      "description": "Optional intent tags for retrieval. Every tag must be an id in research/topics.yaml (validate.py enforces)."
    },
    "unit_detail": {
      "type": [
        "string",
        "null"
      ],
      "description": "Money only: the period or qualifier that used to live in unit, e.g. 'USD/month (gross rent limit)'."
    },
    "value_language": {
      "type": [
        "string",
        "null"
      ],
      "pattern": "^[a-z]{2,3}(-[A-Za-z0-9]{1,8})*$",
      "description": "BCP-47 language of a text value. Required when value_type is text and value is a string."
    },
    "extension": {
      "type": [
        "string",
        "null"
      ],
      "pattern": "^[0-9]{1,6}$",
      "description": "Phone only: extension dialed after the number."
    },
    "x-address-text": {
      "type": "string",
      "description": "Desk address as written by the source, kept when value is a typed place."
    },
    "coordinate_source": {
      "type": "string",
      "description": "How a place value's coordinate was obtained (geocoder, candidate type, score, query, date)."
    },
    "x-flag-value": {
      "type": "boolean",
      "description": "Original yes/no value when Content asked for the fact as text."
    }
  },
  "patternProperties": {
    "^x-": {}
  },
  "additionalProperties": false,
  "allOf": [
    {
      "if": {
        "properties": {
          "status": {
            "enum": [
              "verified",
              "stale"
            ]
          }
        }
      },
      "then": {
        "properties": {
          "source_id": {
            "minLength": 1
          },
          "url": {
            "type": "string",
            "minLength": 1
          },
          "quote": {
            "type": "string",
            "minLength": 1
          }
        }
      }
    },
    {
      "if": {
        "properties": {
          "kind": {
            "const": "lookup"
          }
        },
        "required": [
          "kind"
        ]
      },
      "then": {
        "required": [
          "lookup",
          "desk",
          "value_type"
        ],
        "properties": {
          "value": {
            "type": "null"
          },
          "desk": {
            "minLength": 1
          }
        }
      }
    },
    {
      "if": {
        "not": {
          "properties": {
            "kind": {
              "const": "lookup"
            }
          },
          "required": [
            "kind"
          ]
        }
      },
      "then": {
        "not": {
          "required": [
            "lookup"
          ]
        }
      }
    },
    {
      "if": {
        "properties": {
          "status": {
            "const": "verified"
          }
        },
        "required": [
          "status"
        ],
        "not": {
          "properties": {
            "kind": {
              "const": "lookup"
            }
          },
          "required": [
            "kind"
          ]
        }
      },
      "then": {
        "properties": {
          "value": {
            "not": {
              "type": "null"
            }
          }
        }
      }
    },
    {
      "if": {
        "properties": {
          "value_type": {
            "const": "quantity"
          }
        },
        "required": [
          "value_type"
        ]
      },
      "then": {
        "required": [
          "unit"
        ],
        "properties": {
          "unit": {
            "type": "string",
            "minLength": 1
          }
        }
      }
    }
  ]
}
